"Hướng dẫn về phí công khai, HUD, ngày 25 tháng 3 năm 2011, được truy cập ngày 21 tháng 6 năm 2012"
"Blog tin tức Trung Mỹ, đăng tải tháng 2 năm 2009, truy cập ngày 20 tháng 6 năm 2012"
"Ước tính dân số nhập cư bất hợp pháp, Pew Hispanic Center, 2010, được truy cập vào ngày 20 tháng 6 năm 2012"
"Bài đăng trên Facebook, ""10 sự kiện ngoài hành tinh bất hợp pháp"""
"Pew Hispanic Center, ""Tóm tắt nền chuẩn bị cho lực lượng đặc nhiệm về nhập cư và tương lai của Mỹ,"" ngày 14 tháng 6 năm 2005"
"Pew Hispanic Center, ""Dân số nhập cư trái phép: Xu hướng quốc gia và nhà nước, 2010,"" ngày 1 tháng 2 năm 2011"
"Trung tâm Nghiên cứu nhập cư, ""Sử dụng phúc lợi của các hộ gia đình di cư với trẻ em: Nhìn vào tiền mặt, Medicaid, nhà ở và các chương trình thực phẩm"", tháng 4 năm 2011"
"Trung tâm Nghiên cứu Nhập cư, ""Những người nhập cư ở Hoa Kỳ, 2007: Tiểu sử về dân số sinh ra ở nước ngoài của Hoa Kỳ,"" tháng 11 năm 2007"
"Bộ Nông nghiệp Hoa Kỳ, ""Yêu cầu không phải công dân trong Chương trình tem thực phẩm"", tháng 1 năm 2003"
"Phỏng vấn Steven A. Camarota, giám đốc nghiên cứu tại Trung tâm Nghiên cứu Nhập cư, ngày 18 tháng 6 năm 2012"
"Cuộc phỏng vấn qua email với Kevin R. Johnson, Hiệu trưởng trường Đại học California (Davis), ngày 18 tháng 6 năm 2012"
"Cuộc phỏng vấn qua email với Jeffrey S. Passel, nhà nhân khẩu học cấp cao với Trung tâm Pew Hispanic, ngày 18 tháng 6 năm 2012"
"Cuộc phỏng vấn qua email với Michelle Mittelstadt, giám đốc truyền thông cho Viện Chính sách Di cư, ngày 18 tháng 6 năm 2012"
"Video trên Youtube của bài phát biểu trên sàn của Lisa Brown, ngày 13 tháng 6 năm 2012"
"Video trên Youtube của cuộc họp báo của Lisa Brown, ngày 14 tháng 6 năm 2012"
"Bài đăng trên Facebook, từ trang ""Hướng dẫn của một cô gái để tiếp quản thế giới"", ngày 15 tháng 6 năm 2012"
"MSNBC.com, Lời cuối cùng với Lawrence O’Donnell, ngày 18 tháng 6 năm 2012"
"Detroit News, ""Nhà lập pháp bị cấm nói sau khi nhận xét 'âm đạo',"" ngày 14 tháng 6 năm 2012"
"Cuộc phỏng vấn với Ari Adler, phát ngôn viên của diễn giả Michigan House, ngày 18 tháng 6 năm 2012"
"Cuộc phỏng vấn với Katie Carey, thư ký báo chí cho cuộc họp kín của đảng Dân chủ Michigan, ngày 19 tháng 6 năm 2012"
"Cuộc phỏng vấn với Bob Ballenger, biên tập viên của Chính sách nội bộ Michigan, ngày 18 tháng 6 năm 2012"
"Detroit News, ""Các nhà lập pháp nữ có thể nói - nếu họ đồng ý với đa số nam"", ngày 15 tháng 6 năm 2012, được truy cập qua Nexis"
"Detroit News, ""Hóa đơn phá thai vượt qua Nhà trên đường dây bên,"" ngày 14 tháng 6 năm 2012, được truy cập qua Nexis"
"Bài đăng trên Facebook, ""10 sự kiện ngoài hành tinh bất hợp pháp"""
"Bộ Nông nghiệp Hoa Kỳ, dữ liệu hàng tháng SNAP, được truy cập ngày 18 tháng 6 năm 2012"
"Pew Hispanic Center, ""Dân số nhập cư trái phép: Xu hướng quốc gia và nhà nước, 2010,"" ngày 1 tháng 2 năm 2011"
"Bộ Nông nghiệp Hoa Kỳ, ""Yêu cầu không phải công dân trong Chương trình tem thực phẩm"", tháng 1 năm 2003"
"Bộ An ninh Nội địa, ""Ước tính dân số thường trú hợp pháp trong năm 2010,"" tháng 10 năm 2011"
"Pew Hispanic Center, ""Tóm tắt nền chuẩn bị cho lực lượng đặc nhiệm về nhập cư và tương lai của Mỹ,"" ngày 14 tháng 6 năm 2005"
"Trung tâm Nghiên cứu nhập cư, ""Sử dụng phúc lợi của các hộ gia đình di cư với trẻ em: Nhìn vào tiền mặt, Medicaid, nhà ở và các chương trình thực phẩm"", tháng 4 năm 2011"
"Phỏng vấn Steven A. Camarota, giám đốc nghiên cứu tại Trung tâm Nghiên cứu Nhập cư, ngày 18 tháng 6 năm 2012"
"Chiếm áp phích Facebook post, truy cập ngày 14 tháng 6 năm 2012"
"Health Connector, trang web bảo hiểm y tế cho cư dân Massachusetts, truy cập ngày 13 tháng 6 năm 2012"
"PolitiFact, ""quảng cáo Newt Gingrich nói Mitt Romney ban hành vụ phá thai do người nộp thuế tài trợ"", ngày 19 tháng 1 năm 2012"
"PolitiFact, ""Rick Perry nói"" Romneycare là người mẫu cho Obamacare "", ngày 21 tháng 10 năm 2011"
"PolitiFact, ""Stupak sửa đổi lập trường phá thai trên hóa đơn chăm sóc sức khỏe, trích dẫn lệnh điều hành của Obama,"" ngày 23 tháng 3 năm 2010"
"Chương 58 của Công vụ năm 2006, Tòa án chung Massachusetts, được truy cập ngày 14 tháng 6 năm 2012"
